Category,Value,table_caption,category
Skill and competency of medical staff,59.68Moderate,Health Care Details Table 2,health_care
Speed in completing examinations and reports,61.29High,Health Care Details Table 2,health_care
Equipment for modern diagnosis and treatment,81.90Very High,Health Care Details Table 2,health_care
Accuracy and completeness in filling out reports,65.18High,Health Care Details Table 2,health_care
Friendliness and courtesy of the staff,71.43High,Health Care Details Table 2,health_care
Satisfaction with responsiveness (waitings) in medical institutions,54.46Moderate,Health Care Details Table 2,health_care
Satisfaction with cost to you,46.55Moderate,Health Care Details Table 2,health_care
Convenience of location for you,68.97High,Health Care Details Table 2,health_care
