Category,Value,table_caption,category
Skill and competency of medical staff,81.35Very High,Health Care Details Table 1,health_care
Speed in completing examinations and reports,71.54High,Health Care Details Table 1,health_care
Equipment for modern diagnosis and treatment,71.94High,Health Care Details Table 1,health_care
Accuracy and completeness in filling out reports,73.24High,Health Care Details Table 1,health_care
Friendliness and courtesy of the staff,72.37High,Health Care Details Table 1,health_care
Satisfaction with responsiveness (waitings) in medical institutions,48.79Moderate,Health Care Details Table 1,health_care
Satisfaction with cost to you,59.75Moderate,Health Care Details Table 1,health_care
Convenience of location for you,75.92High,Health Care Details Table 1,health_care
