Category,Value,table_caption,category
Skill and competency of medical staff,71.88High,Health Care Details Table 1,health_care
Speed in completing examinations and reports,72.34High,Health Care Details Table 1,health_care
Equipment for modern diagnosis and treatment,86.58Very High,Health Care Details Table 1,health_care
Accuracy and completeness in filling out reports,77.13High,Health Care Details Table 1,health_care
Friendliness and courtesy of the staff,59.31Moderate,Health Care Details Table 1,health_care
Satisfaction with responsiveness (waitings) in medical institutions,54.89Moderate,Health Care Details Table 1,health_care
Satisfaction with cost to you,64.63High,Health Care Details Table 1,health_care
Convenience of location for you,76.34High,Health Care Details Table 1,health_care
