Category,Value,table_caption,category
Skill and competency of medical staff,81.06Very High,Health Care Details Table 1,health_care
Speed in completing examinations and reports,75.00High,Health Care Details Table 1,health_care
Equipment for modern diagnosis and treatment,86.72Very High,Health Care Details Table 1,health_care
Accuracy and completeness in filling out reports,78.33High,Health Care Details Table 1,health_care
Friendliness and courtesy of the staff,67.19High,Health Care Details Table 1,health_care
Satisfaction with responsiveness (waitings) in medical institutions,54.55Moderate,Health Care Details Table 1,health_care
Satisfaction with cost to you,80.30Very High,Health Care Details Table 1,health_care
Convenience of location for you,81.25Very High,Health Care Details Table 1,health_care
