Category,Value,table_caption,category
Skill and competency of medical staff,80.06Very High,Health Care Details Table 3,health_care
Speed in completing examinations and reports,73.05High,Health Care Details Table 3,health_care
Equipment for modern diagnosis and treatment,90.19Very High,Health Care Details Table 3,health_care
Accuracy and completeness in filling out reports,77.96High,Health Care Details Table 3,health_care
Friendliness and courtesy of the staff,72.15High,Health Care Details Table 3,health_care
Satisfaction with responsiveness (waitings) in medical institutions,53.57Moderate,Health Care Details Table 3,health_care
Satisfaction with cost to you,37.01Low,Health Care Details Table 3,health_care
Convenience of location for you,79.55High,Health Care Details Table 3,health_care
