Category,Value,table_caption,category
Skill and competency of medical staff,71.14High,Health Care Details Table 1,health_care
Speed in completing examinations and reports,62.40High,Health Care Details Table 1,health_care
Equipment for modern diagnosis and treatment,83.12Very High,Health Care Details Table 1,health_care
Accuracy and completeness in filling out reports,68.23High,Health Care Details Table 1,health_care
Friendliness and courtesy of the staff,61.09High,Health Care Details Table 1,health_care
Satisfaction with responsiveness (waitings) in medical institutions,44.26Moderate,Health Care Details Table 1,health_care
Satisfaction with cost to you,67.48High,Health Care Details Table 1,health_care
Convenience of location for you,77.13High,Health Care Details Table 1,health_care
