Category,Value,table_caption,category
Air Pollution,35.77Low,Pollution Details Table 1,pollution
Drinking Water Pollution and Inaccessibility,24.59Low,Pollution Details Table 1,pollution
Dissatisfaction with Garbage Disposal,33.12Low,Pollution Details Table 1,pollution
Dirty and Untidy,51.12Moderate,Pollution Details Table 1,pollution
Noise and Light Pollution,43.83Moderate,Pollution Details Table 1,pollution
Water Pollution,28.10Low,Pollution Details Table 1,pollution
Dissatisfaction with Spending Time in the City,26.84Low,Pollution Details Table 1,pollution
Dissatisfaction with Green and Parks in the City,17.60Very Low,Pollution Details Table 1,pollution
