Category,Value,table_caption,category
Skill and competency of medical staff,73.88High,Health Care Details Table 1,health_care
Speed in completing examinations and reports,70.32High,Health Care Details Table 1,health_care
Equipment for modern diagnosis and treatment,85.78Very High,Health Care Details Table 1,health_care
Accuracy and completeness in filling out reports,76.85High,Health Care Details Table 1,health_care
Friendliness and courtesy of the staff,65.81High,Health Care Details Table 1,health_care
Satisfaction with responsiveness (waitings) in medical institutions,49.52Moderate,Health Care Details Table 1,health_care
Satisfaction with cost to you,79.17High,Health Care Details Table 1,health_care
Convenience of location for you,82.31Very High,Health Care Details Table 1,health_care
